{
  "$schema": "https://vomaste.cz/schemas/canonical/dossier.schema.json",
  "schemaVersion": 1,
  "@context": "https://vomaste.cz/context/v1.jsonld",
  "@id": "https://vomaste.cz/id/dossiers/jan-fischer",
  "@type": "vomaste:Dossier",
  "recordType": "dossier",
  "identifier": "jan-fischer",
  "slug": "jan-fischer",
  "title": "Jan Fischer",
  "description": "Neutrální, zdroji doložený přehled veřejného politického působení — Jan Fischer.",
  "dossierType": "entity",
  "canonicalDossier": "jan-fischer",
  "subject": "jan-fischer",
  "language": "cs",
  "navigationVisible": true,
  "updated": "2026-08-08",
  "authorization": {
    "records": [
      "AUTH-2026-08-08-JAN-FISCHER"
    ]
  },
  "graph": {
    "nodes": [
      {
        "entity": "jan-fischer",
        "label": "Jan Fischer",
        "subject": true,
        "claims": [
          "CLM-01"
        ],
        "sources": [
          "SRC-01"
        ]
      }
    ],
    "edges": []
  },
  "contentBlocks": [
    {
      "type": "markdown",
      "value": "## Rozsah dossieru {#rozsah}\n\nJan Fischer je bývalý 1. místopředseda vlády a ministr financí\n(2013–2014, Rusnokova úřednická vláda); dříve předseda úřednické vlády\n(2009–2010). Jako politicky exponovaná osoba\nv souvislosti s výkonem dřívější veřejné funkce spadá do standing scope\nautorizace (`AUTH-2026-08-05-PLATFORM-SCOPE`); konkrétní záznam pro\ntento dossier je `AUTH-2026-08-08-JAN-FISCHER`.\n\nTento dossier je záměrně založen jako minimální, čistě biografický\nzáznam dřívější vládní funkce doložený oficiálním přehledem členů vlády\nJiřího Rusnoka. Tvrzení nese stav 1 ZDROJ; povýšení na CORROBORATED i\ndoplnění dřívějších či pozdějších funkcí vyžaduje otevření dalších\nzdrojů. Rozšíření rozsahu vyžaduje samostatnou budoucí autorizaci.\n\n## Registr tvrzení {#registr-tvrzeni}\n\n| ID | Tvrzení | Stav | Zdroje |\n|---|---|---|---|\n| <a id=\"clm-01\"></a>[CLM-01](@/dossiers/jan-fischer/claims/clm-01.md) | Jan Fischer byl podle oficiálního přehledu členů vlády Jiřího Rusnoka na webu Vlády ČR 1. místopředsedou vlády a ministrem financí od 10. 7. 2013, přičemž od 13. 8. 2013 do 29. 1. 2014 funkce vykonával v demisi | <span class=\"status-badge status-single\">1 ZDROJ</span> | [SRC-01](@/dossiers/jan-fischer/sources/src-01.md) |\n\n## Metodické omezení\n\nDossier nevyvozuje z uvedených mandátů a funkcí nic dalšího; nejde o\nhodnocení politického působení ani o investigativní rešerši jiných\ntémat."
    }
  ]
}
