{
  "$schema": "https://vomaste.cz/schemas/canonical/dossier.schema.json",
  "schemaVersion": 1,
  "@context": "https://vomaste.cz/context/v1.jsonld",
  "@id": "https://vomaste.cz/id/dossiers/petr-vencalek",
  "@type": "vomaste:Dossier",
  "recordType": "dossier",
  "identifier": "petr-vencalek",
  "slug": "petr-vencalek",
  "title": "Petr Vencálek",
  "description": "Neutrální, zdroji doložený přehled o Petru Vencálkovi — jediném společníkovi a jednateli GMR GAS s.r.o. Autorizovaný rozsah: vlastnictví firmy a její vazba na ukrajinskou GMR GAS UA LLC; dary Klubu motoristů (prověřeno, bez dokladu v hlavním veřejném registru).",
  "dossierType": "entity",
  "canonicalDossier": "petr-vencalek",
  "subject": "vencalek",
  "language": "cs",
  "navigationVisible": true,
  "updated": "2026-08-01",
  "reviewedAt": "2026-08-01",
  "authorization": {
    "records": [
      "AUTH-2026-08-01-VENCALEK"
    ]
  },
  "seo": {
    "seoType": "ProfilePage"
  },
  "contentBlocks": [
    {
      "type": "markdown",
      "value": "## Kdo je Petr Vencálek {#kdo}\n\nPetr Vencálek je podnikatel, jediný společník a jednatel **GMR GAS s.r.o.**\n(Brno, IČO 28274318). Tento dossier je autorizován záznamem\n`AUTH-2026-08-01-VENCALEK` v `AGENTS.md`.\n\n**Proč je v tomto přehledu**, uvedeno hned na začátku: **ne kvůli\nsoukromému podnikání jako takovému.** Vencálek není veřejný funkcionář a\ntest veřejného zájmu u něj sám o sobě je slabý. Základem je výhradně\njeho vazba na už autorizovanou kauzu ministra Petra Macinky — nepřiznaný\npodíl v ukrajinské firmě GMR GAS UA LLC, se kterou je Vencálkova\nspolečnost spojena.\n\n**Co tento dossier výslovně netvrdí**: vlastnit a vést firmu není nic\nprotiprávního. Žádný citovaný zdroj Vencálkovi ani GMR GAS s.r.o.\nnevytýká jakékoli pochybení — je zde jako **záznam vazby** k Macinkově\nkauze, ne jako subjekt vlastního podezření.\n\n## Registr tvrzení {#registr-tvrzeni}\n\n| ID | Tvrzení | Stav | Zdroje |\n|---|---|---|---|\n| <a id=\"clm-01\"></a>[CLM-01](@/dossiers/petr-vencalek/claims/clm-01.md) | Jediným společníkem (podíl 100 %, vklad 200 000 Kč) a jednatelem GMR GAS s.r.o. je Petr Vencálek, jednatelem od prosince 2014 | <span class=\"status-badge status-corroborated\">CORROBORATED</span> | [SRC-01](@/dossiers/petr-vencalek/sources/src-01.md), [SRC-02](@/dossiers/petr-vencalek/sources/src-02.md) |\n| <a id=\"clm-02\"></a>[CLM-02](@/dossiers/petr-vencalek/claims/clm-02.md) | Českou společností za GMR GAS UA LLC je podle obchodního rejstříku GMR GAS s.r.o., IČO 28274318, se sídlem v Brně, zapsaná 2008 pod jménem KADAR s.r.o. a přejmenovaná 2015; mezi jejími zapsanými činnostmi je montáž, opravy a revize plynových zařízení | <span class=\"status-badge status-single\">1 ZDROJ</span> | [SRC-02](@/dossiers/petr-vencalek/sources/src-02.md) |\n| <a id=\"clm-03\"></a>[CLM-03](@/dossiers/petr-vencalek/claims/clm-03.md) | Podle Investigace.cz je GMR GAS UA LLC ukrajinskou pobočkou české společnosti vyrábějící regulátory tlaku plynu a vedle Macinky v ní drží podíl i tato česká společnost a podnikatel Tomáš Cabal | <span class=\"status-badge status-single\">1 ZDROJ</span> | [SRC-01](@/dossiers/petr-vencalek/sources/src-01.md) |\n\n## Vlastnictví GMR GAS s.r.o. a vazba na GMR GAS UA LLC {#kauza-gmrgas}\n\nPetr Vencálek je od prosince 2014 jediným společníkem (100% podíl,\nvklad 200 000 Kč) a jednatelem **GMR GAS s.r.o.**, brněnské firmy\nzapsané v obchodním rejstříku 2008 (do 2015 pod jménem KADAR s.r.o.),\nmezi jejíž zapsané činnosti patří montáž, opravy a revize plynových\nzařízení ([CLM-01](@/dossiers/petr-vencalek/claims/clm-01.md),\n[CLM-02](@/dossiers/petr-vencalek/claims/clm-02.md)).\n\nInvestigace.cz v prosinci 2025 zveřejnila, že ministr zahraničí Petr\nMacinka neuvedl ve svém majetkovém přiznání dvacetiprocentní podíl v\nkyjevské firmě **GMR GAS UA LLC**. Podle článku je tato ukrajinská firma\npobočkou české společnosti vyrábějící regulátory tlaku plynu — GMR GAS\ns.r.o. — a vedle Macinky v ní podíl drží i tato česká firma a podnikatel\nTomáš Cabal ([CLM-03](@/dossiers/petr-vencalek/claims/clm-03.md)). Plné\nznění Macinkovy kauzy nepřiznaného podílu (CLM-14 a CLM-15) je v\n[registru tvrzení jeho vlastního dossieru](@/dossiers/petr-macinka/claims/_index.md).\n\n**Co tento dossier nevyvozuje**: Vencálek ani GMR GAS s.r.o. nejsou\npředmětem žádného tvrzení o pochybení. Kauzou je Macinkova nesplněná\npovinnost přiznat vlastní podíl — existence firmy a jejích dalších\nspolečníků je tu jako záznam vazby, ne jako samostatné téma.\n\n## Dary Klubu motoristů, z.s. {#kauza-dary}\n\nAutorizační záznam `AUTH-2026-08-01-VENCALEK` povoluje pokrýt i téma\ndarů Vencálka Klubu motoristů, z.s. Veřejný rejstřík sponzoringu Hlídač\nstátu byl 2026-08-01 aktivně prověřen\n([SRC-03](@/dossiers/petr-vencalek/sources/src-03.md)): eviduje u\nVencálka jeden dar 20 000 Kč, ale **jiné** politické straně — dar Klubu\nmotoristů ani Motoristům sobě v něm doložen není. Absence záznamu v\njednom registru sama o sobě nedokládá, že dar neexistuje (viz např.\nnepeněžní plnění mimo evidenci u [Richarda\nChlada](@/dossiers/richard-chlad/_index.md#kauza-financovani)) — proto\nzůstává otevřenou položkou, ne tvrzením v žádném směru, v\n[GAP-01](@/dossiers/petr-vencalek/gaps/gap-01.md).\n\n## Co tento přehled nezkoumal {#mezery}\n\nOtevřené mezery vede [registr mezer](@/dossiers/petr-vencalek/gaps/_index.md):\ndary Klubu motoristů, z.s. — autorizované téma, prověřené proti Hlídači\nstátu bez dokladu, ale absence v jednom registru nedokládá, že dar\nneexistuje ([GAP-01](@/dossiers/petr-vencalek/gaps/gap-01.md)).\n\n## Metodické omezení\n\nVlastnit a vést firmu není podezřením. Rejstříková vazba je zaznamenaný\nfakt, ne zjištění o pochybení — a autorizace k tématu darů definuje\nrozsah, necertifikuje reportáž, která zatím nebyla dohledána."
    },
    {
      "type": "timeline",
      "entries": [
        {
          "date": "2014-12-18",
          "title": "Petr Vencálek se stává jediným společníkem (100 %) a jednatelem GMR GAS s.r.o.",
          "anchor": "kauza-gmrgas",
          "dot": "dot-fact",
          "subjects": [
            "vencalek"
          ]
        },
        {
          "date": "2025-12-19",
          "title": "Investigace.cz zveřejňuje kauzu nepřiznaného podílu ministra Macinky v ukrajinské GMR GAS UA LLC a jmenuje Vencálka jako majitele spřízněné české firmy",
          "anchor": "kauza-gmrgas",
          "dot": "dot-fact",
          "subjects": [
            "vencalek"
          ]
        }
      ]
    }
  ]
}
