{
  "$schema": "https://vomaste.cz/schemas/canonical/dossier.schema.json",
  "schemaVersion": 1,
  "@context": "https://vomaste.cz/context/v1.jsonld",
  "@id": "https://vomaste.cz/id/dossiers/jiri-beroun",
  "@type": "vomaste:Dossier",
  "recordType": "dossier",
  "identifier": "jiri-beroun",
  "slug": "jiri-beroun",
  "title": "Jiří Beroun",
  "description": "Neutrální, zdroji doložený přehled veřejného politického působení — Jiří Beroun.",
  "dossierType": "entity",
  "canonicalDossier": "jiri-beroun",
  "subject": "jiri-beroun",
  "language": "cs",
  "navigationVisible": true,
  "updated": "2026-08-09",
  "authorization": {
    "records": [
      "AUTH-2026-08-09-JIRI-BEROUN"
    ]
  },
  "graph": {
    "nodes": [
      {
        "entity": "jiri-beroun",
        "label": "Jiří Beroun",
        "subject": true,
        "claims": [
          "CLM-01"
        ],
        "sources": [
          "SRC-01"
        ]
      }
    ],
    "edges": []
  },
  "contentBlocks": [
    {
      "type": "markdown",
      "value": "## Rozsah dossieru {#rozsah}\n\nJiří Beroun je zastupitel města Znojma (Naše Znojmo). Jako veřejný funkcionář spadá do standing scope autorizace\n(`AUTH-2026-08-05-PLATFORM-SCOPE`); konkrétní záznam pro tento dossier\nje `AUTH-2026-08-09-JIRI-BEROUN`, navazující na výslovnou žádost vlastníka pokrýt celé\nznojemské zastupitelstvo a navázané kauzy.\n\nDossier dokládá aktuální mandát a funkci podle oficiálního webu města\nZnojma. Rozšíření rozsahu\nvyžaduje samostatnou budoucí autorizaci.\n\n## Registr tvrzení {#registr-tvrzeni}\n\n| ID | Tvrzení | Stav | Zdroje |\n|---|---|---|---|\n| <a id=\"clm-01\"></a>[CLM-01](@/dossiers/jiri-beroun/claims/clm-01.md) | Jiří Beroun je podle oficiálního webu města Znojma zastupitelem města za uskupení Naše Znojmo | <span class=\"status-badge status-single\">1 ZDROJ</span> | [SRC-01](@/dossiers/jiri-beroun/sources/src-01.md) |\n\n## Metodické omezení\n\nDossier nevyvozuje z uvedených mandátů a funkcí nic dalšího; nejde o\nhodnocení politického působení ani o investigativní rešerši jiných\ntémat."
    }
  ]
}
